{
  "$schema": "https://json-schema.org/draft/2020-12/schema",
  "$id": "https://mipi.example/contracts/trade-overview/1.0",
  "title": "MIPI Published Trade Overview",
  "type": "object",
  "additionalProperties": false,
  "required": [
    "publication_id", "revision", "published_at", "dataset_id", "title", "unit",
    "latest_period", "provisional_periods", "latest", "timeline", "sections",
    "fact_level", "caveats", "evidence"
  ],
  "properties": {
    "publication_id": { "type": "string", "pattern": "^TIP-" },
    "revision": { "type": "integer", "minimum": 1 },
    "published_at": { "type": "string", "format": "date-time" },
    "dataset_id": { "const": "trade_sitc_1d" },
    "title": { "type": "string", "minLength": 1 },
    "unit": { "const": "RM million" },
    "latest_period": { "type": "string", "format": "date" },
    "provisional_periods": {
      "type": "array", "minItems": 2, "maxItems": 2,
      "items": { "type": "string", "format": "date" }
    },
    "latest": {
      "type": "object", "additionalProperties": false,
      "required": ["exports_rm_million", "imports_rm_million", "balance_rm_million", "exports_mom_percent", "imports_mom_percent"],
      "properties": {
        "exports_rm_million": { "type": "number", "minimum": 0 },
        "imports_rm_million": { "type": "number", "minimum": 0 },
        "balance_rm_million": { "type": "number" },
        "exports_mom_percent": { "type": ["number", "null"] },
        "imports_mom_percent": { "type": ["number", "null"] }
      }
    },
    "timeline": {
      "type": "array", "minItems": 12, "maxItems": 12,
      "items": {
        "type": "object", "additionalProperties": false,
        "required": ["period", "exports_rm_million", "imports_rm_million", "balance_rm_million", "provisional"],
        "properties": {
          "period": { "type": "string", "format": "date" },
          "exports_rm_million": { "type": "number", "minimum": 0 },
          "imports_rm_million": { "type": "number", "minimum": 0 },
          "balance_rm_million": { "type": "number" },
          "provisional": { "type": "boolean" }
        }
      }
    },
    "sections": {
      "type": "array", "minItems": 10, "maxItems": 10,
      "items": {
        "type": "object", "additionalProperties": false,
        "required": ["section", "label_zh", "exports_rm_million", "imports_rm_million", "balance_rm_million"],
        "properties": {
          "section": { "enum": ["0", "1", "2", "3", "4", "5", "6", "7", "8", "9"] },
          "label_zh": { "type": "string", "minLength": 1 },
          "exports_rm_million": { "type": "number", "minimum": 0 },
          "imports_rm_million": { "type": "number", "minimum": 0 },
          "balance_rm_million": { "type": "number" }
        }
      }
    },
    "fact_level": { "const": "F4" },
    "caveats": { "type": "array", "minItems": 1, "items": { "type": "string", "minLength": 1 } },
    "evidence": {
      "type": "object", "additionalProperties": false,
      "required": ["source_id", "source_name", "source_grade", "ingestion_id", "document_id", "document_version", "canonical_url", "content_hash", "crawled_at", "license", "license_url", "attribution"],
      "properties": {
        "source_id": { "type": "string", "pattern": "^SRC-" },
        "source_name": { "type": "string", "minLength": 1 },
        "source_grade": { "const": "S2" },
        "ingestion_id": { "type": "string", "pattern": "^ING-" },
        "document_id": { "type": "string", "pattern": "^DOC-" },
        "document_version": { "type": "integer", "minimum": 1 },
        "canonical_url": { "type": "string", "format": "uri" },
        "content_hash": { "type": "string", "pattern": "^sha256:[0-9a-f]{64}$" },
        "crawled_at": { "type": "string", "format": "date-time" },
        "license": { "type": ["string", "null"] },
        "license_url": { "type": ["string", "null"], "format": "uri" },
        "attribution": { "type": ["string", "null"] }
      }
    }
  }
}
